{
  "$schema": "https://json-schema.org/draft/2020-12/schema",
  "$id": "https://scaneval.dev/schema/v2/trace-event.schema.json",
  "title": "ScanEval observer trace event v2",
  "$comment": "The declaration order of `properties` is the wire key order: both emitters write keys in exactly this order, and tests assert it. `duration_ms` is a whole number of milliseconds, and a link ID that is present is a nonempty string; both emitters refuse anything else rather than emit an event this schema would reject.",
  "type": "object",
  "additionalProperties": false,
  "required": ["schema_version", "event_id", "run_id", "producer_id", "sequence", "type", "category", "capture_status", "timestamp", "metadata"],
  "properties": {
    "schema_version": { "const": "2.0" }, "event_id": { "type": "string", "minLength": 1 },
    "run_id": { "type": "string", "minLength": 1 }, "producer_id": { "type": "string", "minLength": 1 },
    "sequence": { "type": "integer", "minimum": 0 },
    "type": { "enum": ["model.request", "model.response", "tool.start", "tool.end", "context.selection", "finding.candidate", "finding.validation", "finding.filtered", "finding.submitted", "observer.error"] },
    "category": { "enum": ["model", "tool", "context", "finding", "observer"] },
    "capture_status": { "enum": ["complete", "partial", "redacted", "unavailable"] },
    "timestamp": { "type": "string", "format": "date-time" }, "parent_event_id": { "type": "string", "minLength": 1 },
    "call_id": { "type": "string", "minLength": 1 }, "attempt_id": { "type": "string", "minLength": 1 }, "candidate_id": { "type": "string", "minLength": 1 }, "claim_id": { "type": "string", "minLength": 1 },
    "duration_ms": { "type": "integer", "minimum": 0 }, "metadata": { "type": "object" }, "content": { "type": "object" }
  }
}
